{
  "_meta": {
    "version": "1.0.1",
    "updated": "2026-06-13",
    "note": "Central config for ChannelLab bot team. When any ID or member changes, update THIS file only. Run shared/scripts/sync-team-config.sh to propagate to access.json files."
  },
  "owners": {
    "lt": {
      "name": "老兔",
      "user_id": "1050312492",
      "role": "CEO"
    },
    "cj": {
      "name": "菜姐",
      "user_id": "2114307569",
      "role": "Co-founder"
    },
    "ron": {
      "name": "Ron",
      "user_id": "5288537361",
      "role": "Co-founder"
    },
    "nicky": {
      "name": "Nicky",
      "user_id": "7132373174",
      "role": "Head of BD"
    },
    "taotao": {
      "name": "桃桃",
      "user_id": "8201149279",
      "role": "Operations + UIUX"
    },
    "chuange": {
      "name": "川哥",
      "user_id": "5728956655",
      "role": "External contact (台南副秘書長)"
    },
    "33": {
      "name": "33",
      "user_id": "2106884013",
      "tg_username": "Lemoncaiii33",
      "role": "Team Member"
    },
    "lilai": {
      "name": "禮來",
      "tg_username": "lila12888",
      "user_id": "8199138899",
      "role": "內容負責人"
    },
    "wes": {
      "name": "Wesley",
      "user_id": "1342168974",
      "role": "合作夥伴"
    }
  },
  "assistants": [
    {
      "name": "Anya",
      "bot_username": "Anyachl_bot",
      "state_dir": "anya",
      "owner": "lt",
      "role": "特助",
      "description": "老兔特助"
    },
    {
      "name": "Panda",
      "bot_username": "Ron0001_bot",
      "state_dir": "ron-assistant",
      "owner": "ron",
      "role": "特助",
      "description": "Ron特助"
    },
    {
      "name": "張凌赫",
      "bot_username": "ZhangLingheAI_bot",
      "state_dir": "nicky-zhanglinghe",
      "owner": "nicky",
      "role": "特助",
      "description": "Nicky特助"
    },
    {
      "name": "主廚",
      "bot_username": "CarrotAAA_bot",
      "state_dir": "caijie-zhuchu",
      "owner": "cj",
      "role": "特助",
      "description": "菜姐特助"
    },
    {
      "name": "Elon",
      "bot_username": "chltao_bot",
      "state_dir": "chltao",
      "owner": "taotao",
      "role": "特助",
      "description": "桃桃特助"
    },
    {
      "name": "Diana",
      "bot_username": null,
      "state_dir": "keeper",
      "owner": "lt",
      "role": "company-agent",
      "description": "ChannelLab 公司 AI 核心。常駐智能體，管理全公司知識庫（Ocean），協調子系統（總管 sub-agent 等）。無 TG bot，透過 relay 與 Anya 溝通。"
    },
    {
      "name": "會長",
      "bot_username": "netero33_bot",
      "state_dir": "33-huizhang",
      "owner": "33",
      "role": "特助",
      "description": "33特助"
    },
    {
      "name": "暴风",
      "bot_username": "fanfan608bot",
      "state_dir": "lilai-fengfeng",
      "owner": "lilai",
      "role": "特助",
      "description": "禮來(Lilai)特助，禮來為內容負責人"
    },
    {
      "name": "Wes_buddy",
      "bot_username": "Wes_buddy_bot",
      "state_dir": "wes-buddy",
      "owner": "wes",
      "role": "特助",
      "description": "Wes 特助"
    }
  ],
  "shared_pools": {
    "builder": [
      {
        "name": "Anna",
        "bot_username": "annadesu_bot",
        "state_dir": "anna",
        "affinity": [
          "lt",
          "nicky",
          "taotao"
        ]
      },
      {
        "name": "三菜",
        "bot_username": "threedishes_bot",
        "state_dir": "sancai",
        "affinity": [
          "cj"
        ]
      },
      {
        "name": "Eric",
        "bot_username": "Ron0002_bot",
        "state_dir": "ron-builder",
        "affinity": [
          "ron"
        ]
      }
    ],
    "reviewer": [
      {
        "name": "Bella",
        "bot_username": "Bellalovechl_Bot",
        "state_dir": "Bella",
        "affinity": [
          "lt",
          "nicky",
          "taotao"
        ]
      },
      {
        "name": "一湯",
        "bot_username": "onesoup_bot",
        "state_dir": "yitang",
        "affinity": [
          "cj"
        ]
      },
      {
        "name": "KKKK",
        "bot_username": "ron0003_bot",
        "state_dir": "ron-reviewer",
        "affinity": [
          "ron"
        ]
      }
    ],
    "designer": [
      {
        "name": "星星人",
        "bot_username": "TwinkleCHL_bot",
        "state_dir": "twinkle",
        "affinity": [
          "lt",
          "ron",
          "nicky",
          "cj",
          "taotao"
        ]
      }
    ]
  },
  "owner_preferences": {
    "lt": {
      "builder": [
        "anna",
        "sancai"
      ],
      "reviewer": [
        "Bella",
        "yitang"
      ],
      "note": "老兔/Anya 優先 Anna+Bella，可借三菜/一湯/Eric/KKKK"
    },
    "ron": {
      "builder": [
        "ron-builder"
      ],
      "reviewer": [
        "ron-reviewer"
      ],
      "note": "Ron/Panda 優先 Eric+KKKK，可借 Anna/三菜/Bella/一湯"
    },
    "cj": {
      "builder": [
        "sancai"
      ],
      "reviewer": [
        "yitang"
      ],
      "note": "菜姐/主廚 優先三菜+一湯，可借其他"
    },
    "nicky": {
      "builder": [
        "anna",
        "sancai"
      ],
      "reviewer": [
        "Bella",
        "yitang"
      ],
      "note": "Nicky/張凌赫 優先 Anna+Bella"
    },
    "taotao": {
      "builder": [
        "anna",
        "sancai",
        "ron-builder"
      ],
      "reviewer": [
        "Bella",
        "yitang",
        "ron-reviewer"
      ],
      "note": "桃桃/Elon 可用全部共用池"
    }
  },
  "groups": {
    "main_team": {
      "chat_id": "-1003634255226",
      "label": "主團隊群（Bella群）",
      "note": "Upgraded from supergroup. All bots active here."
    },
    "coordinator": {
      "chat_id": "-5175060310",
      "label": "特助協調群",
      "note": "【備用】目前未啟用，保留供未來跨線資源排程；新協作一律走 main_team + FATQ"
    },
    "lt_command": {
      "chat_id": "-1005267778636",
      "label": "老兔指揮室",
      "note": "Supergroup-upgraded ID. Old value was -5267778636."
    },
    "ron_command": {
      "chat_id": "-1003612111775",
      "label": "Ron指揮室"
    },
    "nicky_command": {
      "chat_id": "-5002663624",
      "label": "Nicky指揮室"
    },
    "cj_command": {
      "chat_id": "-5180494548",
      "label": "菜姐指揮室"
    },
    "taotao_command": {
      "chat_id": "-5291099801",
      "label": "桃桃工作群"
    },
    "test_group": {
      "chat_id": "-5103207922",
      "label": "測試群"
    },
    "cj_extra_1": {
      "chat_id": "-5034023909",
      "label": "菜姐附加群 1 (TODO: confirm label)"
    },
    "cj_extra_2": {
      "chat_id": "-5200547431",
      "label": "菜姐附加群 2 (TODO: confirm label)"
    },
    "33_work": {
      "chat_id": "-5046019226",
      "label": "33工作群"
    },
    "lilai_teaching": {
      "chat_id": "-5208584620",
      "label": "lilai agent 教學群"
    }
  },
  "dms": {
    "lt": "1050312492",
    "ron": "5288537361",
    "nicky": "7132373174",
    "cj": "2114307569",
    "taotao": "8201149279",
    "chuange": "5728956655",
    "33": "2106884013",
    "lilai": "8199138899",
    "wes": "1342168974"
  }
}